{
  "document": {
    "schema": "https://agent-workflow.dev/schemas/workflow-definition.json",
    "name": "minimal-poc-smoke",
    "version": "0.0.0"
  },
  "state_schema": {
    "type": "object",
    "properties": {
      "ok": { "type": "boolean" }
    }
  },
  "nodes": [
    { "id": "begin", "type": "start" },
    { "id": "finish", "type": "end" }
  ],
  "edges": [
    { "source": "__start__", "target": "begin" },
    { "source": "begin", "target": "finish" }
  ]
}
